{
  "$schema": "./rig.contract.schema.json",
  "contractVersion": "1.0.0",
  "authority": {
    "repo": "live-rig",
    "runtimeDependency": false,
    "summary": "Authority repo for topology, shared vocabulary, exported mapping snapshots, and failover doctrine."
  },
  "survivabilityTiers": {
    "A": {
      "id": "A",
      "label": "Audio survives independently",
      "minimumOutcome": "Main audio path remains playable even if controller or visual runtimes are absent.",
      "requiredCapabilities": [
        "One active clock boss only",
        "Mixer to PA path remains intact",
        "Emergency blackout or safe visual path is documented"
      ]
    },
    "B": {
      "id": "B",
      "label": "One controller path and one visual path survive",
      "minimumOutcome": "At least one controller route and one controllable visual endpoint remain available.",
      "requiredCapabilities": [
        "Shared scene/state vocabulary remains addressable",
        "Direct MIDI or OSC can bypass the preferred UI",
        "At least one visual endpoint or utility visual path remains available"
      ]
    },
    "C": {
      "id": "C",
      "label": "Optional enrichment",
      "minimumOutcome": "Analysis, secondary endpoints, and lab outputs can drop out without ending the set.",
      "requiredCapabilities": [
        "Analysis lane can disappear without blocking scene recall",
        "Secondary endpoint is optional",
        "Offline or lab repos are never the only source of a required control path"
      ]
    }
  },
  "controlLanes": {
    "macro": {
      "id": "macro",
      "purpose": "Human-operated continuous control lane for scene shaping and live overrides.",
      "primarySources": [
        "live-rig-control",
        "Edirol PCM-30",
        "bridge direct MIDI or OSC"
      ],
      "primaryConsumers": [
        "MSVP",
        "SCapps bridge",
        "nw_wrld"
      ],
      "midiChannels": [10],
      "requiredFor": ["B"]
    },
    "analysis": {
      "id": "analysis",
      "purpose": "Normalized audio-reactive bias lane that enriches but never gates the visual system.",
      "primarySources": [
        "frZone"
      ],
      "primaryConsumers": [
        "MSVP",
        "SCapps bridge",
        "nw_wrld"
      ],
      "midiChannels": [15],
      "requiredFor": ["C"]
    },
    "semantic": {
      "id": "semantic",
      "purpose": "Discrete scene, state, and event trigger lane used by UI, bridge, and hardware fallback controls.",
      "primarySources": [
        "live-rig-control",
        "Maschine MK1",
        "bridge direct OSC or MIDI"
      ],
      "primaryConsumers": [
        "MSVP",
        "SCapps bridge",
        "nw_wrld"
      ],
      "midiChannels": [10],
      "requiredFor": ["B"]
    }
  },
  "endpointRules": {
    "invariants": [
      "Endpoints follow clock; they never originate global transport.",
      "Canonical scene, state, and event IDs are owned by the shared rig contract, not by endpoint repos.",
      "MSVP and nw_wrld or wrld_on operate as peer endpoints behind the same contract."
    ],
    "degradation": [
      "If analysis is unavailable, endpoints continue from scene base plus manual macro input only.",
      "If one endpoint is unavailable, switch to the other endpoint or a documented clean-camera or blackout utility path.",
      "If the preferred UI is unavailable, direct MIDI or OSC still targets the same semantic IDs through the bridge.",
      "If the authority repo is unavailable at runtime, exported snapshots remain sufficient for consumers."
    ]
  },
  "semanticCatalog": {
    "scenes": [
      {
        "id": "scene.intro",
        "label": "Intro",
        "description": "Establishing scene family shared across controller and endpoint layers."
      },
      {
        "id": "scene.soft",
        "label": "Soft",
        "description": "Low-intensity scene family for calmer or more spacious visuals.",
        "aliases": ["scene.soft_ash"]
      },
      {
        "id": "scene.crash",
        "label": "Crash",
        "description": "High-intensity scene family for harsh or saturated moments.",
        "aliases": ["scene.angel_swarm"]
      },
      {
        "id": "scene.clean_camera",
        "label": "Clean Camera",
        "description": "Minimal-processing visual state that preserves documentary clarity."
      }
    ],
    "states": [
      {
        "id": "state.blackout",
        "label": "Blackout",
        "description": "Fastest safe visual kill and reset state."
      },
      {
        "id": "state.manual_override",
        "label": "Manual Override",
        "description": "State where direct human control takes priority over automation or weighted modulation."
      }
    ],
    "events": [
      {
        "id": "event.noise_burst",
        "label": "Noise Burst",
        "description": "Bounded hit event for hybrid audiovisual impact."
      },
      {
        "id": "event.glitch_hit",
        "label": "Glitch Hit",
        "description": "Short-lived event that spikes a glitch treatment without changing the long-form scene."
      }
    ],
    "macros": [
      {
        "id": "macro.vmix_morph",
        "label": "Mixer Morph",
        "description": "Crossfades between current visual layers or worlds."
      },
      {
        "id": "macro.fb_feedback",
        "label": "Frame Buffer Feedback",
        "description": "Controls visual memory or echo intensity."
      },
      {
        "id": "macro.mael_depth",
        "label": "Maelstrom Depth",
        "description": "Controls tunnel or well depth."
      },
      {
        "id": "macro.mosh",
        "label": "Mosh",
        "description": "Controls aggressive glitch or stream-collision intensity."
      },
      {
        "id": "macro.retrace_density",
        "label": "ReTrace Density",
        "description": "Controls line or contour density in trace-based worlds."
      },
      {
        "id": "macro.texture_detail",
        "label": "Texture Detail",
        "description": "Controls grit or fine-texture detail in texture-oriented worlds."
      },
      {
        "id": "macro.analysis_blend",
        "label": "Analysis Blend",
        "description": "Crossfades between analysis influence and manual macro authority."
      }
    ],
    "analysis": [
      {
        "id": "analysis.low_band",
        "label": "Low Band",
        "description": "Bass-weighted energy from the analysis lane."
      },
      {
        "id": "analysis.mid_band",
        "label": "Mid Band",
        "description": "Midrange body energy from the analysis lane."
      },
      {
        "id": "analysis.upper_mid_band",
        "label": "Upper Mid Band",
        "description": "Presence or abrasive energy from the analysis lane."
      },
      {
        "id": "analysis.high_band",
        "label": "High Band",
        "description": "High-frequency air, cymbal, or hiss energy from the analysis lane."
      }
    ]
  },
  "repoRegistry": [
    {
      "id": "live-rig",
      "role": "authority",
      "summary": "Owns topology, vocabulary, failover doctrine, and exported snapshots. It is not a runtime dependency on show night.",
      "consumes": [
        "show notes",
        "post-show lessons",
        "sibling repo capability statements"
      ],
      "produces": [
        "authority contract",
        "exported runtime profile",
        "mapping snapshots",
        "failover documentation"
      ],
      "requiredFor": [
        "planning",
        "contract publication"
      ],
      "fallbacks": []
    },
    {
      "id": "live-rig-control",
      "role": "controller",
      "summary": "Preferred performer UI that emits the shared semantic lane plus concrete MIDI and OSC bindings.",
      "consumes": [
        "shared scene and state vocabulary",
        "exported runtime profile",
        "mapping snapshots"
      ],
      "produces": [
        "semantic scene, state, and event triggers",
        "macro lane output",
        "degraded-state operator messaging"
      ],
      "requiredFor": [
        "preferred control",
        "mapping-driven UX"
      ],
      "fallbacks": [
        {
          "when": "live-rig-control is unavailable",
          "target": "Edirol plus Maschine direct into bridge",
          "outcome": "Shared scene and state IDs remain reachable without the preferred UI."
        }
      ]
    },
    {
      "id": "frZone",
      "role": "analysis",
      "summary": "Publishes normalized analysis outputs and band mappings only. It never owns scenes, transport, or endpoint-specific logic.",
      "consumes": [
        "post-fader audio bus"
      ],
      "produces": [
        "analysis lane output",
        "normalized band data"
      ],
      "requiredFor": [
        "analysis enrichment"
      ],
      "fallbacks": [
        {
          "when": "frZone is unavailable",
          "target": "scene base plus manual macros",
          "outcome": "Visuals continue without analysis bias."
        }
      ]
    },
    {
      "id": "MSVP",
      "role": "endpoint",
      "summary": "Beat-synced visual endpoint that consumes shared scenes, states, macros, and analysis without redefining the contract.",
      "consumes": [
        "shared semantic IDs",
        "macro lane",
        "analysis lane",
        "forwarded clock when required"
      ],
      "produces": [
        "Syphon or video output",
        "endpoint health state"
      ],
      "requiredFor": [
        "primary or secondary visual endpoint"
      ],
      "fallbacks": [
        {
          "when": "MSVP is unavailable",
          "target": "nw_wrld or clean-camera or blackout utility path",
          "outcome": "One visual endpoint survives without requiring MSVP."
        }
      ]
    },
    {
      "id": "nw_wrld",
      "role": "endpoint",
      "summary": "Runtime visual platform for project-driven visuals. It remains a peer endpoint rather than the contract authority.",
      "consumes": [